[
  {
    "id": "loc.silverthorn",
    "name": "Silverthorn",
    "biome": "temperate-town",
    "faction_control": "council",
    "points_of_interest": [
      "market_square",
      "old_watchtower"
    ],
    "encounter_tables": {
      "any": [
        "street-brawl",
        "quiet-night"
      ]
    },
    "connections": [
      {
        "target": "loc.alderics-chambers",
        "travel_time": 0,
        "danger": 0.0
      },
      {
        "target": "loc.whisperwood",
        "travel_time": 2,
        "danger": 0.2
      },
      {
        "target": "loc.hushbriar-cove",
        "travel_time": 4,
        "danger": 0.35
      }
    ],
    "travel_rules": {},
    "danger_level": "safe"
  },
  {
    "id": "loc.alderics-chambers",
    "name": "Alderic's Chambers",
    "biome": "royal-quarters",
    "faction_control": "council",
    "points_of_interest": [
      "briefing-table",
      "sealed-desk",
      "observation-balcony"
    ],
    "encounter_tables": {
      "any": [
        "hushed-briefing"
      ]
    },
    "connections": [
      {
        "target": "loc.silverthorn",
        "travel_time": 0,
        "danger": 0.0
      }
    ],
    "travel_rules": {},
    "danger_level": "safe"
  },
  {
    "id": "loc.whisperwood",
    "name": "Whisperwood / Sporefall",
    "biome": "corrupted-forest",
    "faction_control": "unknown",
    "points_of_interest": [
      "spore-choked-path",
      "aodhans-camp"
    ],
    "encounter_tables": {
      "day": [
        "spore-wolf-pack"
      ],
      "night": [
        "myconid-wraith"
      ]
    },
    "connections": [
      {
        "target": "loc.silverthorn",
        "travel_time": 2,
        "danger": 0.35,
        "requirements": [
          {
            "subject": "flag",
            "key": "entered_whisperwood",
            "comparator": "==",
            "value": false
          }
        ]
      },
      {
        "target": "loc.hushbriar-cove",
        "travel_time": 3,
        "danger": 0.4
      }
    ],
    "danger_level": "volatile"
  },
  {
    "id": "loc.hushbriar-cove",
    "name": "Hushbriar Cove",
    "biome": "coastal-town",
    "faction_control": "harbor-wardens",
    "points_of_interest": [
      "salt-market",
      "tide-hollows"
    ],
    "encounter_tables": {
      "day": [
        "smuggler-envoy"
      ],
      "night": [
        "dockside-ambush"
      ]
    },
    "connections": [
      {
        "target": "loc.silverthorn",
        "travel_time": 4,
        "danger": 0.25
      },
      {
        "target": "loc.whisperwood",
        "travel_time": 3,
        "danger": 0.45
      },
      {
        "target": "loc.solasmor-monastery",
        "travel_time": 6,
        "danger": 0.55
      }
    ],
    "danger_level": "tense"
  },
  {
    "id": "loc.solasmor-monastery",
    "name": "Solasmor Monastery",
    "biome": "clifftop-monastery",
    "faction_control": "solasmor-order",
    "points_of_interest": [
      "scriptorium",
      "lighthouse"
    ],
    "encounter_tables": {
      "any": [
        "chanting-rite"
      ]
    },
    "connections": [
      {
        "target": "loc.hushbriar-cove",
        "travel_time": 6,
        "danger": 0.45
      }
    ],
    "travel_rules": {},
    "danger_level": "austere"
  }
]